{
  "schemaVersion": 1,
  "status": "draft",
  "notes": [
    "Prompts and answer choices are transcribed verbatim from Find_Your_Class_Pilot_Blueprint_v1.md section 8 (Q1-Q12). criteriaClarified and each answer's mutation direction are a first structural mapping onto assets/find-your-class/criteria.json -- the blueprint specifies player-facing wording and intent, not exact numeric mutation payloads, so mutations here are qualitative (criterionId + direction/desiredPosition/importanceHint) pending Codex's numeric calibration. Section 9's discriminator list (Fighter vs Magus, Sorcerer vs Druid, etc.) is separate adaptive-selection logic, not part of this static template file.",
    "allowNotRelevant is true for every question per the blueprint's own answer lists, which each include a literal 'Not relevant' option except Q10 (campaign levels, which has no Not relevant option in the blueprint).",
    "Contract, fixed after Codex's review of commit 8c5efdd: (1) a capability-kind criterion (criteria.json kind:\"capability\") is only ever mutated with importanceHint/importance + notRelevant, never desiredPosition -- desiredPosition is exclusively for directional-kind criteria, and loader.js's checkKindMatch() now rejects the wrong field for a criterion's kind. (2) 'Not relevant' on a question clarifying more than one criterion must clear every criterion listed in that question's criteriaClarified, not just the first one. (3) every answer's mutations array is either non-empty or the answer carries nonScoring:true -- an empty array with no flag is always a bug, not an intentional no-op (Q1/Q2's 'no strong lean' answers, Q6's UI-mode toggle, Q10's 'I do not know', and Q12's three navigation-only options are the only nonScoring:true cases)."
  ],
  "questions": [
    {
      "id": "q-martial-magic-centre",
      "prompt": "What should make your character feel powerful?",
      "criteriaClarified": ["martial-magic"],
      "allowNotRelevant": true,
      "estimatedCognitiveCost": 1,
      "priority": 10,
      "answers": [
        { "label": "Mastering weapons and physical technique.", "mutations": [{ "criterionId": "martial-magic", "desiredPosition": 1 }] },
        { "label": "Combining weapons and magic.", "mutations": [{ "criterionId": "martial-magic", "desiredPosition": 5.5 }] },
        { "label": "Having magic for almost every problem.", "mutations": [{ "criterionId": "martial-magic", "desiredPosition": 10 }] },
        { "label": "I am open to any of these.", "mutations": [], "nonScoring": true },
        { "label": "Not relevant.", "mutations": [{ "criterionId": "martial-magic", "notRelevant": true }] }
      ]
    },
    {
      "id": "q-melee-ranged",
      "prompt": "Where do you want to spend most fights?",
      "criteriaClarified": ["melee-ranged"],
      "allowNotRelevant": true,
      "estimatedCognitiveCost": 1,
      "priority": 10,
      "answers": [
        { "label": "In the middle of melee.", "mutations": [{ "criterionId": "melee-ranged", "desiredPosition": 1 }] },
        { "label": "Moving between close and medium range.", "mutations": [{ "criterionId": "melee-ranged", "desiredPosition": 5.5 }] },
        { "label": "Safely at range.", "mutations": [{ "criterionId": "melee-ranged", "desiredPosition": 10 }] },
        { "label": "I want to switch depending on the encounter.", "mutations": [], "nonScoring": true },
        { "label": "Not relevant.", "mutations": [{ "criterionId": "melee-ranged", "notRelevant": true }] }
      ]
    },
    {
      "id": "q-preparation",
      "prompt": "How do you feel about choosing spells or abilities before the adventuring day begins?",
      "criteriaClarified": ["no-heavy-preparation"],
      "allowNotRelevant": true,
      "estimatedCognitiveCost": 1,
      "priority": 8,
      "answers": [
        { "label": "I would rather avoid it.", "mutations": [{ "criterionId": "no-heavy-preparation", "desiredPosition": 1 }] },
        { "label": "A little preparation is fine.", "mutations": [{ "criterionId": "no-heavy-preparation", "desiredPosition": 5.5 }] },
        { "label": "I enjoy preparing the right tools.", "mutations": [{ "criterionId": "no-heavy-preparation", "desiredPosition": 10 }] },
        { "label": "Not relevant.", "mutations": [{ "criterionId": "no-heavy-preparation", "notRelevant": true }] }
      ]
    },
    {
      "id": "q-turn-complexity",
      "prompt": "What kind of combat turns sound enjoyable?",
      "criteriaClarified": ["routine-tactical", "turn-complexity"],
      "allowNotRelevant": true,
      "estimatedCognitiveCost": 1,
      "priority": 8,
      "answers": [
        { "label": "A reliable plan I can execute quickly.", "mutations": [{ "criterionId": "routine-tactical", "desiredPosition": 1 }, { "criterionId": "turn-complexity", "desiredPosition": 1 }] },
        { "label": "A few strong choices without too much bookkeeping.", "mutations": [{ "criterionId": "routine-tactical", "desiredPosition": 5.5 }, { "criterionId": "turn-complexity", "desiredPosition": 5.5 }] },
        { "label": "Many tactical choices and interacting abilities.", "mutations": [{ "criterionId": "routine-tactical", "desiredPosition": 10 }, { "criterionId": "turn-complexity", "desiredPosition": 10 }] },
        { "label": "Not relevant.", "mutations": [{ "criterionId": "routine-tactical", "notRelevant": true }, { "criterionId": "turn-complexity", "notRelevant": true }] }
      ]
    },
    {
      "id": "q-companion-burden",
      "prompt": "Would you enjoy controlling another creature?",
      "criteriaClarified": ["none-central-companion", "extra-entity-burden"],
      "allowNotRelevant": true,
      "estimatedCognitiveCost": 1,
      "priority": 9,
      "answers": [
        { "label": "No; I want to manage only my own character.", "mutations": [{ "criterionId": "none-central-companion", "desiredPosition": 1 }] },
        { "label": "A simple familiar or occasional summon is fine.", "mutations": [{ "criterionId": "none-central-companion", "desiredPosition": 4 }] },
        { "label": "I want a meaningful animal companion or similar partner.", "mutations": [{ "criterionId": "none-central-companion", "desiredPosition": 8 }] },
        { "label": "Managing several creatures sounds fun.", "mutations": [{ "criterionId": "none-central-companion", "desiredPosition": 10 }, { "criterionId": "extra-entity-burden", "desiredPosition": 10 }] },
        { "label": "Not relevant.", "mutations": [{ "criterionId": "none-central-companion", "notRelevant": true }, { "criterionId": "extra-entity-burden", "notRelevant": true }] }
      ]
    },
    {
      "id": "q-outside-combat",
      "prompt": "What would you most like to contribute outside combat?",
      "criteriaClarified": ["stealth-infiltration", "social-influence", "knowledge-investigation", "wilderness"],
      "allowNotRelevant": true,
      "estimatedCognitiveCost": 2,
      "priority": 7,
      "multiSelect": true,
      "answers": [
        { "label": "Stealth, traps and infiltration.", "mutations": [{ "criterionId": "stealth-infiltration", "importanceHint": "high" }] },
        { "label": "Conversation, deception or intimidation.", "mutations": [{ "criterionId": "social-influence", "importanceHint": "high" }] },
        { "label": "Knowledge, investigation and magical answers.", "mutations": [{ "criterionId": "knowledge-investigation", "importanceHint": "high" }] },
        { "label": "Wilderness and exploration.", "mutations": [{ "criterionId": "wilderness", "importanceHint": "high" }] },
        {
          "label": "Combat is my main priority.",
          "mutations": [
            { "criterionId": "stealth-infiltration", "importanceHint": "low" },
            { "criterionId": "social-influence", "importanceHint": "low" },
            { "criterionId": "knowledge-investigation", "importanceHint": "low" },
            { "criterionId": "wilderness", "importanceHint": "low" }
          ]
        },
        { "label": "Choose several.", "mutations": [], "nonScoring": true, "notes": ["UI-mode toggle: switches this question into multi-select. multiSelect:true already allows picking several of the checkbox answers directly; this option carries no preference of its own."] },
        { "label": "Not relevant.", "mutations": [
            { "criterionId": "stealth-infiltration", "notRelevant": true },
            { "criterionId": "social-influence", "notRelevant": true },
            { "criterionId": "knowledge-investigation", "notRelevant": true },
            { "criterionId": "wilderness", "notRelevant": true }
          ] }
      ]
    },
    {
      "id": "q-battlefield-impact",
      "prompt": "When combat starts, what sounds most satisfying?",
      "criteriaClarified": ["single-target-damage", "area-damage", "crowd-control", "ally-buffing", "specialist-versatile"],
      "allowNotRelevant": true,
      "estimatedCognitiveCost": 1,
      "priority": 8,
      "answers": [
        { "label": "Bringing down one dangerous enemy.", "mutations": [{ "criterionId": "single-target-damage", "importanceHint": "high" }] },
        { "label": "Damaging several enemies at once.", "mutations": [{ "criterionId": "area-damage", "importanceHint": "high" }] },
        { "label": "Controlling where enemies can move or act.", "mutations": [{ "criterionId": "crowd-control", "importanceHint": "high" }] },
        { "label": "Making allies stronger or safer.", "mutations": [{ "criterionId": "ally-buffing", "importanceHint": "high" }] },
        { "label": "Adapting to whatever the fight needs.", "mutations": [{ "criterionId": "specialist-versatile", "desiredPosition": 10 }] },
        { "label": "Not relevant.", "mutations": [
            { "criterionId": "single-target-damage", "notRelevant": true },
            { "criterionId": "area-damage", "notRelevant": true },
            { "criterionId": "crowd-control", "notRelevant": true },
            { "criterionId": "ally-buffing", "notRelevant": true },